<?xml version="1.0" encoding="ISO-8859-1"?>
<options xmlns:xsi="http://www.w3.org/2001/XMLSchema-instance" xsi:noNamespaceSchemaLocation="option2.xsd">
    <cours id="c1" titre="XML">
        <responsable>D. Vodislav</responsable>
        <descripition>Ce cours permet de 
            <objectif>decouvrir le format XML</objectif>et
            <objectif>maistriser les langages lies a XML</objectif>
            . prerequis:<prerequis>JAVA</prerequis>et<prerequis>XML</prerequis>
        </descripition>
        <seance no="1" date="20/09/2019">Introduction</seance>
        <remarque>Enseignement en anglais</remarque>
    </cours>
    <cours id="c2" titre="Developing mobile applications">
        <responsable>D. Kotzinos</responsable>
        <descripition>...</descripition>
        <seance no="1" date="20/09/2019">Introduction</seance>
        <remarque>Enseignement en anglais</remarque>
    </cours>
    <etudiant numero="n123456">
        <nom>Philippe Dupont</nom>
        <option cours="c1" note="14"/>
        <absence type="justifiee">27/09/2019</absence>
    </etudiant>
</options>